"title","author","email","DOI"
"Genotype and local environment dynamically influence growth, disturbance response and survivorship in the threatened coral, Acropora cervicornis","Crawford Drury","druryc@hawaii.edu","10.1371/journal.pone.0174000"
"Growth Data of Genotypes from the Rescue a Reef Nursery ","Martine D'Alessandro","mdalessandro@rsmas.miami.edu ",NA
"Aropora cervicornis Genet Tissue Properties","Chris Langdon","clangdon@rsmas.miami.edu",NA
"Census of heat tolerance among Florida's threatened staghorn corals identifies resilient individuals throughout nursery populations","Ross Cunning","rcunning@sheddaquarium.org","10.1098/rspb.2021.1613"
"Temporal variation of coral genotype peerformance","Katherine Eaton","katherine.eaton@noaa.gov",NA
"Acropora Cervicornis Data Coordination Hub, an Open Access Database for Evaluating Genet Performance","Patrick M Kiel","patrick.kiel@noaa.gov","10.5343/bms.2022.0064"
